"Do not let the matacritic score fool you ! It is comprised of people who are quick to label the film edgy jusy because it touches on social matters, people who in my opinion should not be able to publish a movie rating as professionals. Everything that has to do with The Joker is done in a perfect way. Not only is phoenix's performance astonishing but the cinematography and climate of the film are perfect. It is truly a drama that makes an excellent background story for the character and has you on your heels everytime Joaquin is on the screen. Plus the violence felt very impactful and carried a message instead of simply being a way to make the film more intense."
"This is not a really good Movie.This Movie is whatever people can say, when they so not find words after seeing it.2hrs with a Villain ......I wont Spoil this great experience. I would be the Villain If I would do.Thank you Todd Phillips."
I almost didn't go to see this as I've always had a problem viewing movies that have so hyped. But to be honest this is one movie worth seeing. I have been a total fan of Heath Ledgers Joker since it came out but to be fair this is worthy of being right up there with it. Phoenix's Joker is mesmerising and I found it hard to look away no matter how difficult the situation. I felt a lot of things during this performance and didn't need the whole box and dice of CGI trickery to get me there! Just stunning performances by all concerned. I would highly recommend this movie to anyone
Joaquin Phoenix's performance in joker is amazing everything about this movie is amazing. Amazing script great acting 10/10 you need to see this movie
"From the director of ""The Hangover"" trilogy comes a dark and gritty version of Joker's origin story. His version of the Joker seems to be heavily inspired by Martin Scorsese's ""The King of Comedy"" with a touch of ""Taxi Driver"". On top of that, there are some attempts of commentary about society and how crooked it is. When you mix all those things up, you get a film that's going to divide everyone's opinions.Let's begin with the good stuff first. Easily, the best part of the film was a performance by Joaquin Phoenix. He carried this film completely and he gave one of the better performances of his career (nothing is going to beat his performance in ""The Master""). He proved once again why he's one of the best actors working today. If someone else was in his place, there's no way this film would've worked. His mannerisms, facial expressions (especially how he showed so many different emotions through laughs and eye expressions at the same time), his physicality and his vulnerability were incredible. If this film received a bit better reviews he would definitely be the main contender for that Oscar. Furthermore, the next aspect with which I was blown away was the score. I would even say that the score was a more effective way of showing emotions than the script. Because of the score at every moment, you knew how you were supposed to feel regarding what's happening on the screen, and that was achieved in a way that wasn't forceful. If you listen carefully to the score, you can even distinguish what scenes happened in reality and which were just in his imagination. Those two aspects of the film were outstanding and they carried the film noticeably. The color palette really nicely supported the script. Through the colors in the film, you could've seen in what mood the main character was and how he felt about what was happening around him. Colors helped to immerse the audience into that time period (I would say the film happened in 1981 because the movie theatre was showing the film ""Blow Out"" which came out in that year), but that wouldn't work without production design which was on the point.
The cinematography was decent. Although the director's vision wasn't groundbreaking I generally enjoyed most of the camera choices.Let's get into some aspects that weren't so good. The script. It's one of the weakest parts of the film. You get a feeling the film wanted to say a lot, but unfortunately, it ended up saying almost nothing. There were a lot of attempts to give some social commentary, but for me personally, that fell flat because there wasn't any explanation of why is everything how it is. Joker as a character for the huge part of the film was complaining about how society is bad and how everyone is mean, but there wasn't any reason given why is the world like that, beyond poverty and poor people suck and rich people are corrupted and evil. Regarding that specific aspect, I felt like the director wanted to say a lot, but it just ended up being shallow and on the nose. The film was beating you over the head of how everything is bad. I would've appreciated concluding by myself that the world is crooked, but instead, I was just told what the situation was, without any room for my own interpretations. And that explained situation wasn't backed up with any other pieces of information. This time, tell don't show approach didn't work out. Furthermore, speaking of the script, all characters except Joker were unbelievable and underwritten. Zazie Beetz was completely unutilized and the relationship between her character and the Joker was underdeveloped. The film was supposed to make you believe in their relationship, but it didn't and because of it the film suffered at the later stages of its runtime. I understood what did film tried to achieve with their relationship, but that wasn't realized very well. That sentence could've been used for many aspects of this film. Robert De Niro as an older version of Rupert Pupkin had a ton of fun in this film, one of the better De Niro's performances since ""Casino"". They could've done more with his character, but at least it seemed like he had fun with this project. So, Joker is basically the only character that was decently written, but the thing is, the director didn't make a clear choice if we were supposed to feel for him or we were supposed to hate him because of his actions. Don't get me wrong, he isn't a good person, but the film way too many times tried to make the audience sympathize with him. I don't know if that was intentional or not, but at the times it felt way too forceful.In the end, looking at the whole picture, this is a good film but isn't anything spectacular. At the same time, I would say the film was overblown with praises of how good it was, and yet at the same time, it was unfairly criticized because of some aspects in the film (e.g. the usage of violence)."
"I must say I'm disappointed. I love the Batman universe and especially the story behind Joker. Considering it's been a lot of talk around this movie, I expected more. The first half of the movie was pretty long drawn, towards the end it was great but not so much before that in my opinion. They could have done so much more with the time they had.
Also, something that I struggle with is that every move Joker made was very predictable basic psychology (my opinion). Joker isn't supposed to be predictable, that is a part that makes him so interesting. Besides from all that the actor did an amazing job potraying Joker!"
"Heath ledger would be so proud!
It was amazing! Blew my mind ! I will watch it again and again !
After a long time finally a good movie ! Enjoyed every second with every cell of my body !"
"A long time i did not enjoy and get marveled by a film.
If the decition depend on me, I said, Oscar to Best Film, And Oscar to Best Leading Role to Joaquin Phoenix, there is no equal, One of the most difficult role to perform in movies history and its overwhelm by Joaquin. You must see this film an prepear to see masterful performance in every detail."
"Every year I deal with one issue - less new movies that deserve to be called art. But Joker is a rare example of what you can call art in every way. The creators of this movie made 2019 successful by making Joker, making the viewer feel wide range of emotions that push us beyond borders of standard perception. Thank you for this piece of art, a gift for all of us who create new perceptions and new visions."
"It's been reported that some people found the level of violence so graphic they have walked out of the showing..I can understand why. It's inexcusable that they did as they missed the ultimate tale in morality and their lives will be poorer for that fact.If you expect to see a bells and whistle CGI extravagance, you'll be disappointed. If, like me, you want a psychonautical joyride into the creation of the character of Joker.. open yourself to the lesson you're about to receive.Joaquin's portrayal is by far the superior version and most credible I have watched to date and his is a performance, I feel, cannot be surpassed, and should not, as here is the ultimate lesson of the nature of humanity - a poignant tale of human kindness and the consequences when that chain fails.. there are always repercussions for that imbalance and in the Joker, we see the deepest, darkest, most tragic and twisted sequence of consequences that should be a wake up call for us all, particularly now with the social injustices that are now common place. A Joker is reflected in each dispossessed person and we are many.A genuine masterclass in acting by Phoenix. The collaboration between Todd Phillips and Scott Silver is sheer brilliance."
"I miss Heath Ledger and can't get enough of his portrayal of Joker. He was intimidating, scary, unpredictable and all other things. In 2016, we got Suicide Squad and Jared Leto as Joker both of which disappointed me very much. After that, I thought that I don't want to see another Joker interpretation on the big screen. I was skeptical when I heard that a standalone Joker movie was in works. Then I heard about the casting of Joaquin Phoenix as Joker and I developed an interest in it because I love his work. He is a method actor and has given some of my favorite performances for example in Her (2013) and The Master (2012). I decided to see the movie in the theater after hearing a lot about the movie, good and bad and I am glad that I saw it.This movie is really good, it exceeded my expectations and Joaquin Phoenix should get an Oscar for his work. He is phenomenal and I was blown away by his performance. His performance alone carries the whole movie and lets you experience and understand the character without saying much. His physique, movements, gestures, grace, way of speaking suggests that he gave his everything to make the character compelling and stand out from other Joker portrayals. He lost 52 pounds for the role. He embodied the character of Joker. Comparing his performance with Heath Ledger will be absurd. There is no common ground for comparison. Both interpretations of Joker are significantly different, the story is different, character motivations are different.Now talking about the story, this is a standalone Joker movie that shows how a man beaten up, neglected and humiliated by the society turns into a maniac. This movie follows Arthur Fleck who works as a party clown and lives with his mother. He wants to be a stand-up comic. He suffers from a condition causing him to laugh uncontrollably. We feel his loneliness, depression, and condition and sympathize with him for it. All the other performances were also very good. This movie isn't that much violent as people are saying it to be, but it makes you feel the violence and it is unsettling. It also allows the viewer to form their perspective about the character. Sometimes you will agree with his actions and sometimes you won't. There are also certain funny scenes in the movie but not everyone may find it funny.The movie is directed by Todd Phillips and he has done an outstanding job. I didn't think that the guy who made The Hangover movies can pull this off, but he did it. He showed that as a filmmaker, he can make more than just R rated comedies. The film is set in 1981 and the period is very well reflected in the movie. The cinematography is top-notch. Shot composition, camera placement, camera movement has been handled well. I was surprised by how good the Gotham city looked, beautiful and dirty at the same time. Each scene had a color scheme. The lights in the surroundings like light from streetlights, cars or the sky illuminated everything with their light. Joker/Arthur Fleck's emotions get conveyed through shades of light falling on him which is beautiful to look at. Music is beautiful, chilling, hypnotizing and speak lengths about the inner feelings of the character.I have just a few issues with the plot of the movie and how some things happen which shouldn't have happened or couldn't have happened, rest the movie is flawless."
"I really liked the way heath ledger portrayed joker in dark knight. Funny, cunning, evil. If he was living today, he would have aced this movie. But surprisingly, Joaquin does it even better. He is rarely funny but very alone and pathetic. His condition becomes worse and worse until he breaks out, wreaking havoc to Gotham. The story flows smoothly through Arthur's life, how the situation around influences him to become the joker. The supporting characters including Robert de Niro have done an excellent job but nobody can beat Joaquin. He was at a completely different level!! A pure masterclass of cinema. If you are a fan of joker, don't miss this one! Another Oscar worthy performance from Joaquin. If he gets it, it ll be second time for the same role."
You never seen anything like this Joaquin shines so bright that you would be amazed of how great he is in this movie everything about this movie is perfect i promise.
Unbelievable!!! Movie of the year absolutely. 👏🏻
"'Joker (2019)' is one of the most intense and disturbing films I've seen in a long time. It really is surprisingly fantastic, an unsettling and complex character-study that's as uncompromising as it is gripping. Inspiration was clearly taken from 'The King Of Comedy (1982)' and, to a lesser degree, 'Taxi Driver (1976)', but this isn't just a cut-and-paste copy. It's very much its own beast, as much a horror movie as it is a comic-book one. Don't let Phillips fool you, by the way, this certainly is a comic-book movie. It's a phenomenal comic-book movie that blows almost all others out of the water, but a comic-book movie nonetheless. It takes inspiration from several well-known storylines and has a firm grasp on both its titular character and all the other classic Gotham elements, much more so than one might expect given the marketing. None of this is meant as a slight, just an exploration of the fact that comic-book movies are ""real"" movies. Here, we have a probable career-best performance from Phoenix, who's often frightening even when sitting still, and a definite career-best directorial effort from Phillips, who seems to have elevated himself far beyond the generally well-regarded 'The Hangover (2009)'. The whole thing is just so well-made, clearly crafted with absolute clarity of vision from the very beginning. The screenplay is great, the cinematography is gorgeous and the musical score is outright masterful. The flick works so well because it doesn't pretend there are 'heroes and villains'. You don't really identify with the protagonist, you pity him. You want him to be okay, to find a way out of his inevitably dark situation, but certainly aren't cheering along with him when things eventually get even worse. There's no 'good guy', just a guy. He undergoes some serious trauma and, often, the piece elicits a strong emotional response when this happens. Yet, when he decides to deal with it in a criminal way, you're never 'on his side'. Instead, you just watch in shock and horror, glued to the edge of your seat. Indeed, the violence here is some of the most impactful I've seen, each moment punching you straight in the gut. It's not fun, it's horrible and that's how it should be. There's no doubt that this is an amazing feature. It's absolutely gripping and I can't stress that enough. It gets under your skin and wriggles around, as interesting to reflect on as it is to watch. It's not exactly 'nice' but it's not supposed to be. It's brave, realistic stuff that's easily up there, right at the top, as one of the best of the year. As a footnote, I just can't believe how well they incorporated the Joker's classic laugh into a piece as grounded as this; it's chilling, tragic and integral to the character, yet still as over-the-top as you'd think (though, you might not realise it when it happens). Honestly, I still can't quite comprehend how good this whole affair is. It's simply divine. 9/10"
"We watched Joker tonight, and I expected good acting from Joaquin Phoenix, wasn't sure about the story and everything else but I was willing to see how it will go. What I didn't expect was that I wouldn't blink an eye throughout the movie. It was absolutely brilliant. Joaquin Phoenix didn't just give us good performance, but made Joker so real. Like he is one of us, and as my friend said - scary part was that you could relate to him and be on the same track with his thoughts. Everything is perfect in this movie - story, acting, photography, music... hell even the colors of this world are perfect. Joaquin Phoenix carried the whole storry on his back - it was an one man show that took all your attention, imagination, stirred all your feelings and emotions and left you speechless when The End letters came on the screen. The best movie this year for sure - Phoenix deserves Oscar for this one and any other reward he can get in this world. BRILLIANT!!!!"
Spectacular ...phenomenal..brearhtaking !! Joaquin Phoenix is truely a LEGEND!!!!
"Travis Bickle is also an anti-hero like Arthur Fleck, so many bad things at once, a product of the times, but his actions are never justified or rendered aspirational either through plot or aesthetics of the film. The same goes for Rupert Pupkin in Scorsese's another masterpiece 'The King of Comedy' from which Todd Philips, the director, heavily borrows but without any proper insight or thought. Class divide, neurological issues, childhood trauma and all that glitter is thrown in the movie to disguise the shallow depth of ideas and adds to the confusion. The film tries to be so many things and ends up being none. 'Poser' would be a better title.Joaquin Phoenix's acting is everything though. Very familiar but still feels fresh and knocks your socks off (and oh that laugh is haunting) and he was the singular reason I didn't walk out of the film after the first 15 minutes because the moment Arthur Fleck commits the third murder (and which obviously was not a self-defense tactic), I thought, ""lo beta, ghus gaye na ghhade me! Yahan se impossible hai nikalna."" And making my worst fears come true, this humorless film just kept on digging that first act grave.So, in short: Loved Joker. Just hated the film he was in.PS: Watch HBO's 'Succession' if you want to take notes on how to have a people as your protagonists, humanize them and still maintain that much-necessary ironic distance from them."
"I'm shocked bad movie overrated realiy you guys follow media this isn't good things juat go and watch the real joker (the dark knight ) then came and rate this , and i have no more words but i must file it i have no more words but i must file it"
"Not as good as i thought, too much overrated by people"
Just came back from the theater. Joaquin is an absolute genius. This movie is not about violence at all..those who think that they just miss the whole point. Be kind to each other. That's all I'm going to say.
"What a movie!! From start to finish it is an absolute masterpiece, the way Phoenix portrays the Joker is a Oscar worthy performance. The movies overall message about mental health and how people get affected is amazing, it shows that doesn't matter what goes on people always have problems and always need help!! Will hands down be one of, if not the best movie of 2019!"
"DO NOT go and waste your money there... the film is boring boring boring at the end of the movie I was still waiting for the crimes, thriller scene and drama is bad bad bad...."
"Joker is the best movie to release this year. I doubt any movie releasing this year will come close to it. Joker tackles mental illnesses perfectly. Despite the brutalities he's caused throughout the movie, you can't just help yourself but to feel sorry for him. I'd be a liar if I said I didn't cry at least twice during the movie. Fleck really shows how one bad day can drive you over the edge. It perfectly depicts how mental illnesses can drive you to do inhumane stuff. The violence in Joker felt way too real, all the deaths in the film, the 3 Wall Street guys, Arthur's mom, Randall, Murray Franklin. I felt like I was there for the deaths. The death that hit me the most was Murray, it was so sudden and out of the blue. Arthur really looked up to Murray as a father figure, an icon. When Arthur admitted to killing the Wall Street guys, that's when he really turned into Joker. Arthur Fleck was long gone.Joker really isn't a movie. It's a wake up call. It's a fictionalized documentary. It goes to show how one bad day can destroy your entire life. If you're suffering from mental illnesses, please don't hesitate to ask for help."
"What a fantastic evening out - with son and daughter (both older than the lead!) and loads of popcorn to see Joaquin Phoenix give the performance of his life in Joker.
No spoilers and a huge amount to contemplate and revisit in further viewings. Suffice to say this is a slow burn movie with brilliant director, leading cast and cinematography and run down Gotham City staging that makes this a mesmerising movie experience. Everyone will be talking about their favourite moments - mine includes a certain door key!
Joaquin as the evil Emperor Commodus gave us the famous 'thumbs down' to Russell Crowe as Maximus in Gladiator but it is a resounding 'thumbs up' for his remarkable portrayal of mentally ill Arthur Fleck in his descent to madness to become the criminal mastermind known as the Joker.
."
"I'm going to keep this short and sweet because there isn't much that hasn't already been said and explored but if you're reading this wanting a little input or motivation to see this movie, then all I can say is ""If you don't get it, you won't like it, if you do get it, you won't stop thinking about it.""Best movie in a long time."
"One of the most amazing films that I have ever seen in my lifetime. Phoenix, De Niro, and the entire cast are fantastic. Phoenix's acting is ""off the hook"" amazing. Rarely have I ever left the movie theater mesmerized by what I just saw. I am just simply glad that I saw a masterpiece like that in my lifetime...and it proved to me that the film industry, one that has been sadly fixated on CGI and special effects, is still capable of making a film that can penetrate the soul of the audience with a great script and amazing acting."
I went in with high expectations and came out absolutely blown away. A timeless piece of cinema with one of the greatest acting performances of all time.
"A engaging story, some splendid cinematography, stellar acting. Joaquin Phoenix gave the best performance as a villain since Heath Ledger as Joker. A true Masterpiece"
"To appreciate ""Joker"" I believe you have to have either gone through something traumatic in your lifetime (and I believe most of us have) or understand somewhere in your psyche what true compassion is (which usually comes from having gone through something traumatic, unfortunately). An example of dangerous compassion would be to, say, make a film made about the fragility of the human psyche, and make it so raw, so brutal, so balletic that by the time you leave the theatre you not only don't want to hurt anything but you desperately want an answer and a solution to the violence and mental health issues that have spun out of control around us.
-Josh Brolin"
"Few modern, mainstream films today can be considered art, but this breaks the mould.I spent the first two thirds of this film in tears, it provoked a very painful reaction from me. Society, in particular, the worst parts of our society, were represented in an extreme way, nonetheless it did depict how we treat each other and especially how we treat people that are different to us.By the time Joker was unleashed, I was actually glad that he felt freed, confident and enacting his revenge on some of the worst people imaginable. By the end of the movie, I was rooting for him. Very odd given the things he was doing.The way in which this film was shot is mesmerising, the cinematography, score and Joaquin's acting are flawless. The film retains the comic book feel but is very real.I've said several times that no interpretation of Joker could eclipse Heath Ledger's, but Joaquin is just next level, some of the best acting I have ever seen.Joker is a masterpiece."
"If this film doesn't win several Oscar's, I will eat my hat! Mr Phoenix is sublime. This is an incredible portrayal of a character descending into madness and the most intense I have ever seen. As an actor, JP executes with genius. A great film and the best I've seen all year. Right up there with the greats!!!"
"This movie will make you sad, make you angry and maybe it'll make you a little bit crazy too."
I was numb on the first half of the movie. Shouldn't have watched it because now I can't get over it. I will lose faith in humanity if Joaquin Phoenix is not winning Oscar for this.
What i saw was the best movie I've ever seen since long time
