"How is this Joker suppost to stand a chance against Batman? I thought what made joker such a great villain was his intelligence, his manipulative ability and his ability to see the inner fears of his rivals. How far will he get by only being crazy and unpredictable? Juaquin could problably get pretty far (all the way to the Oscars stage), while Joker can't even enter through a door."
"I was so hype after the trailer, and kinda expecting to be disappointed because DC you khow... but well it turn out even better than what the trailer had shown, and im grad its.
The acting in this movie is too good, hat off to the new joker Joaquin Phoenix. He deserved an oscar for this act.
The story line is still kinda classic joker's but its darker and a lot more twist, i cant count how many time i almost jump off my sit by suprise and excitement.
And there is sooo many dark joke... i love it."
"I'm not usually a fan of comic based movies. I was never a fan of batman because I'm having a hard time taking people in costumes seriously. I went to watch joker because all of the hype and I was genuinely expecting it to be a so-so performance. I went there watching the Heath Ledger's joker before, which was OK in my opinion, as I said, I'm not a batman movies fan.
However.
This movie is not about batman, is not about comics, is not about superheros. This is a drama film. A drama which touches you deep inside on a special level, a movie which you feel because at least once you will sympathize with the joker. You will find yourself debating inside, whether he should be excused for his actions. Seeing Phoenix portray Arthur, from a beaten man, to become THE joker, quite by accident, is an extraordinary journey. The movie deserves all the praise it gets, and some.
I can't recommend the movie enough, as it's just THAT good."
Ive only seen a few batman movies so i decided to go watch joker and since joaquin was the leading actor i thought it would be decent. i was impressed with the movie completely from the narrative to the soundtrack to the ending. and acting from joaquin was phenomenal deserves a OSCAR hands down!!! best performance ive seen in years since decaprio and the revenant. its so good im going next weeknd and watch it again...i havent done that since well ive never done that before. 10/10 movie i couldnt find a flaw in his acting role
Thank goodness I didn't bring my little one with me. Me and my older kids enjoyed it. This movie is very dark and violent. One of the best prequels I have ever seen. Mr. Phoenix really deserves an Oscar for his portrayal of the Joker. This one of my top two movies this year. Almost two and a half hours long but worth it!
"What an actor! Absolutely brilliant, loved it ! An Oscar winning performance for sure !"
A political incorrect movie but it real happen everywhere and everyday! The best movie this year.
"This is my first review on this site and I must say 10/10
Just saw it a while ago. No words to describe the phoemix´s job
Yes! Its one of the best movies of all time
and the oscar goes to...."
"Absolutely one of the best movies I have seen, and will see again...I enjoyed every twist, turn, and the furthering of the evolution of the character and the slow and drastic turn to violence and chaos at a whim. Fantastic movie!"
"Little to say. I expected a masterpiece of a movie only based on comic books, and concentrated only in a character study for the ages.It is.Perfect story. Twists. Real drama. Real pain. Darkly funny at times, but not comedic in the least. It is violent, as it should, but never glorifying violence like the rest of the comic book adaptations (even the ones I love like Man of Steel or Infinity War or...)It is just perfect. I give my ""Thanks"" to all the people involved (I gave my money too, which is more important to them).----------- As a negative, It's not particularly original, with too many things (a few times, scenes) from King of Comedy and Taxi Driver.
It is clearly better than those movies though"
"This is the definition of the word STUNNING! Because that's what Phoenix was at this movie! It is a performance of a lifetime! I have no idea how he achieved this turn and brought this character to its highest but it cant get any better. We love all Jokers but here we have a different character, a different man, a man that we can finally understand, finally understand Joker's Why... This character was portrait-ed multidimensional by Phoenix! It was about time to expose today's society. This movie will shock you in a way, make you sad and at the end it will make you happy with the Batman connection and the comic and gaming scene! The whole movie was a masterpiece and can lead to many awesome sequels with Batman, Harley Quin etc... They just need to be careful. An Oscar performance with a small budget! Good job DC."
The best movie of this year. The best Joker I have ever seen. Very realistic
"Well, this was certainly quite an anticipated movie, and just to think that it was made by the guy that came up with The Hangover. Then again this film is certainly not a pleasant movie by no means, but that certainly does not necessarily mean that it is a bad movie. Yeah, it is meant to make you feel really uncomfortable, and in a way you sort of also feel a lot of sympathy for the main character. In a way, by the end of the film, I am really wanting him to actually become the Joker, though of course this is all left in Limbo with the way the ending actually comes about.One thing I have to say is that Joaquin Phoenix is absolutely outstanding. I remember people suggesting that nobody could ever top Heath Ledger's portrayal of the Joker, and of course there was Jared Leno who came along with Suicide Squad, yet Joaquin Phoenix truly moves this character to a completely new level. Yeah, we all suspected that the Joker was crazy, but the way Phoenix captures the dark insanity of the character, the way he captures his mental illness, is absolutely outstanding.Thus, what begs the question is, could he actually be the Joker that we all know and love (and if it wasn't for the fact that the Joker is a much loved villain we wouldn't have got this movie - in fact I'm not at all sure if there is any other villian out there that could literally have a movie of their own). The reason I say this is because Phoenix's Joker is seriously disabled, yet when we encounter the Joker elsewhere, while he might pretend to be crazy, he all know that he has his wits about him.The thing is that I don't believe that Phoenix's Joker could actually be the 'clown-prince of crime' because, well, I'm not entirely sure whether he is actually capable of interacting with people, let alone being the calculating criminal that he is famous for. The reason is that he really doesn't seem to be capable of being able to interact with people. In fact, he is more of a symbol, this is something that slowly becomes relevant as the movie progresses, until we get to the end. Of course, the ending is very ambiguous, and some of the suggestions that he is a joker as opposed to The Joker, really doesn't sit with me all that well.However, in a way it sort of makes sense, him being a symbol and all that. One suggestion, and it is a suggestion that I sort can agree with, is that he actually died in the car crash (something that isn't all that surprising considering he was hit by an ambulance on the side of the car in which he was sitting), and the crowds removed him carefully, as if he was some sort of martyr. Sure, the final scene certainly doesn't suggest that he is in heaven or anything, but the thing is that many characters literally take on a force of personality, one in which the actual person could never fulfill, and Arthur is certainly no leader, not in that sense of the word, and as such he can really only exist as a symbol.Yet we must remember that there is so much about this film that we simply do not know what is truth and what is hallucination. The thing is that Arthur is seriously disconnected from reality, that becomes pretty clear with the 'relationship' that he has with the woman down the hallway. Yeah, once that becomes clear, and it should not have been any surprise as all, it really throws into a lot of doubts what is actually happening, what is real and what is not. Then again, there are a lot of scenes going on in the background, which do give us hints that there certainly is a reality that is unfolding, which means that he certainly did kill the three men on the subway, and murdered Murray live on national television.Yet even Thomas Wayne, a character that is certainly not held in such high regard in this film, has an ambiguous side to him. Then again, in the other Batman films, we see so little of the character that he is seen as some angelic figure. Yet in this film, once again, the truth, and the reality, are two completely different things. Still, the whole question of whether he did have an affair with Arthur's mother, and that Arthur is actually his illegitimate son, is certainly thrown into a lot of doubt.So, yeah, this is a pretty awesome film, and it is certainly one of those films that is going to leave you thinking and trying to understand it for quite a while after leaving the cinema. Honestly, it is pretty good that we are starting to see more of these movies come into the cinema now, after a very long drought full of a bunch of quite sub-par action flicks."
"I'll first start by saying this movie is very dark. It's the type of movie that makes you uncomfortable at some point in every scene. That being said, it's exactly the way this character should be portrayed. Amazing performance by Joaquin Phoenix as he takes you through the journey for Jokers evolution. This isn't a movie full of action packed fighting or battle scenes. Instead, it's a real life example that mirrors our world today. Amazing performances. Amazing film."
I was just stunned after watching the movie . A sure nomination for the Oscars !!!
"Hated was looking forward to it. Its not for anyone to watch. Promotes hate violence suicide and Murder.
Please pick another movie to go to. Not sure what movie the other people were watching."
"Parisians love movies. As I walk around the city, I see hundreds of movie theatres with all kinds of movies playing. Today, I decided to look at a big, multiplex movie theatre that is right around the corner from where I am staying, UGC CINÉ CITÉ LES HALLES - would you believe it is showing 46 films on 27 separate screens?When you go to a French movie and you speak as little Frecnh as I do, you'll need to go see an American or English movie that is NOT dubbed but rather sub-titled. France has acronyms that describe what you will see -VO stands for Version Originale, or the original version of the film with French subtitles for audiences that do not understand the native language of the film.VF stands for Version Française, meaning that it is the French version of the film which has been dubbed with French audio - no subtitles.VOSTFR stands for Version Originale Sous-Titrée en FRançais, meaning that it is the original version of a film with subtitles in French.Finally, the term VOST stands for Version Originale Sous-Titrée, or the original version of a film with subtitles in the film's original language.Most American films are dubbed in France and it is strange to hear the voices since they are nothing like the actor's real voice.I saw Joker at a packed house. The audience was much more quiet than an American one. But, first, let me answer the question I know you are asking yourself - and the answer is Yes, they sell popcorn and it's good, but you'll have to first answer the BIG question when you order - sweet or sour? Sweet? Sour? I answered - sel, seulemont (salt only). The young woman was incredulous, but gave me my popcorn.The most important thing about the movie you should know is that Joker is not about the Joker you and I and the rest of the world associate with Batman. This Joker is the Joker who became that Joker. Yes, eventually, he commits crimes but they are the ordinary crimes that most non-supervillains commit.This Joker, played with wild abandon by Joaquin Phoenix, is a mommy's boy who has delusions of being normal. He lives in a city that resembles New York City in the 1970s. If you weren't there, it was a garbage-strewn, graffiti-emblazoned mess. Arthur Fleck, Joker's real name, is a clown who plays at childrens' parties. One day, he loses his job (the reason is silly) and discovers that his much-adored mother (Frances Conroy) may be as crazy and delusional as he is. Along the way, the film takes potshots at cutting the funding for mentally ill people - anyway, it's a really bad day and Arthur snaps.One of his heroes is a Tonight-like show's host, Murray Franklin, played unconvincingly by Robert DeNiro. I think that is the first time I used that word to describe a DeNiro performance, but his totally stiff appearance makes his being cast as a Johnny Carson-ish character one of the greatest miscastings in the history of the movies. I mean, DeNiro would be better cast as Robin Hood or Cary Grant. Add the miscasting to the fact that the character is totally unappealing and you have hit the movie disaster jackpot.Arthur longs to be a stand-up comic and make people laugh. His mother, may or may not have had Arthur during an affair with Thomas Wayne (Brett Cullen) - and there's your Batman connection.Joker is one of the most evil films I have ever seen. I know that seems a strange word to use, but this movie cynically uses the depressingly wide gap between the haves and have-nots in America to act as a backdrop to a story that has no purpose other than to make us wince and squirm. Director/co-writer Todd Philips' most famous contribution to cinema has been the Hangover series. His writing partner, Scott Silver's last movie, The Finest Hours, lost $50,000,000.00 in the US. Hollywood studio heads, if you don't understand the anger of female writers and directors in Hollywood, take another look at Scott Silver. Yes, he was nominated for an Oscar for The Fighter, but there were three other writers on that script. Seventeen years ago, he wrote a hit movie, 8 Mile. Since then he has done nothing of note, yet here he is co-writing a big-budget movie and making a mess of it.I emphasis the creators because this is one of the most poorly written scripts I have even seen made into a big-budget movie and I have seen some doozies. This is a movie that made me run home to shower. It is such an ugly look at the world that there is nothing at all that is redeeming about it. The most shocking moment is when we see Mr. Phoenix in his underwear - he looks seriously ill, almost malnourished. And his excesses don't stop there - his is one of the most undisciplined performances I have ever seen.I have to mention the score because it is as bad as the rest of the movie. Written by Hildur Gudnadottir, it stops and starts and then disappears then BANG! BOP! Then it's just gone. Two words came to mind when it was over - thank god.Joker is a world-wide hit. Some would argue that is the proverbial bottom line - who cares that it's not only junk, but evil junk, lots of people have gone to see it. Lots of people, in the past, have gone to hangings, beheadings, bear baitings and public burnings too. I am certain most people went to see Joker thinking they were going to see the Batman franchise Joker who had been played thrillingly by Jared Leto, Heath Ledger, Caesar Romero and Jack Nicholson. Well, the joke is on them. Us. Me. You."
"Joaquin Phoenix is good. The directing is pretty good. The writing is absolutely awful. This movie is trying so hard to be relevant and to have a 'message' that it just throws a jumbled mess of quasi-commentary at you hoping something will stick. It is completely unclear what exactly writer/director Todd Phillips is actually trying to say, if anything. Is Joker a hero of the resistance or is he an incel? Does he go crazy because he's mentally ill or because people are mean to him? Both rich people and poor people are horrible to Joker so what exactly is the class commentary? It's also confusing how Robert De Niro when this movie is clearly ripping off Taxi Driver in many ways, also with a little Mr. Robot thrown in. There's also a subplot with a neighbor that is so incredibly stupid and pointless, which actually has no bearing on the story whatsoever. The movie is also just listless and boring throughout much of it. A movie can be slow-paced without it being boring if interesting things are happening that are driving the plot towards it's conclusion. The only thing driving the story in this movie is knowing that he's going to become joker at some points, not anything that actually happens in the movie. The movie also spends like 5 minutes making fun of a little person for no clear reason. Also for people saying that this movie does a good job saying why you should be nicer to people especially if they're lonely or have mental health issues: firstly you shouldn't need a movie like this to be nice to people, secondly you can make a movie like that where the lonely/mentally ill person doesn't become a murderer since mentally ill people are more likely to be victims than perpetrators of crime, and thirdly if you want a movie showing why you need to empathize with criminals why not movies about all the people of color who have been victims of mass incarceration and were locked up on nonviolent charges instead of a movie about a white male becoming a mass murderer. This movie is terrible."
"This is an origin story of a famous superhero villain, and not quite. You don't need to have extensive knowledge on all the lore of DC supers because Joker is a fresh new take on the very popular character. It is a film with an anti-hero protagonist, and an anti-superhero in terms of its overall tone. I must say, it is storytelling at its finest."
This was a wonderful study of the what could be behind the Joker. It is also a great commentary on our society and times and how the Media and the 1% create all of the problems that the rest of us are expected to deal with. Thomas Wayne is a great representation of the elite political class and how they think they know what is best for everyone.
"Many of us over the years have been attached and thrilled with the ""Clown Prince of Crime"" as D.C. comic fans know as the one and only ""Joker"". And we've seen different takes and spins from Romero's camp, to Ledger's dark wild crazy turn, and the man the one and only Jack played the clown with vanity and brought a proper turn to a bad guy while having fun(Nicholson's ""Joker"" was like that of the late 70's early 80's ""Joker"" in D.C. comics) now enter Phoenix who's much different with a creepy origin story.Set in the early 1980's Gotham city is gritty, raw and the social and political climate is in the gutter as just getting by is so tough. And just tip toeing and dancing his way thru the drama is Arthur Fleck(in a hell of a turn from Joaquin at least nominate him for a ""Golden Globe"" or ""Oscar"") a lonely and depressed mommies boy who's a skinny starving clown who just can't fit in he's a society misfit. It's really somewhat of a sad character study.However hope is possible in the form of Fleck wanting to get away from being a clown for children as his real dream is to be a standup comedian as his smile and crazy lasting laugh is always present! As laughter is the cure for his pain! His hope of escape is to appear on a late night talk show hosted by Murray Franklin(Robert De Niro) where Arthur hopes to showcase his talents. Also the only other wild card pleasure he has in his life is dating a single mom named Sophie(Zazie Beetz) from his apartment building. And his sick mother Penny keeps Arthur hanging on with love and hope as that keeps him hanging on.Only secrets and ghost of the past and painful memories only destroy the fragile mind of Arthur even more as a connection to millionaire Thomas Wayne is revealed and even more shattering is how this connection and more events will lead to ""The Dark Knight"". Great and excellent work from director Todd Phillips who despite making a stand alone dark character study still connects things up with others in the D.C. universe.Many might see this picture as a dark tragedy I think it's a take and spin on how one is affected by life and then they take on a different role after years of being abused and mistreated in the world by it's people. Still this film is excellent because it's unique and finally glad a stand alone movie celebrates ""The Joker""(the greatest comic book bad guy ever!) As Joaquin's performance was raw, gritty, and a lashing out of some payback to society. Wow enough said best D.C. comics character study ever made!"
"Very good movie. The first half of the movie was slow, but second half was amazing"
"Such an incredible reimagining of a fan favorite classic supervillain. This movie is set in the 80s but consistently feels like present times, which is a triumph in itself. Joaquin Phoenix again cements his immense range and talent as he completely absorbs the audience with his commitment to the character. Director Todd Phillips also proves once and for all that he too has a wide range of talent as a director and can take his films to the next level.
Astonishingly beautiful score writtenCompletly grasping and thrilling plotThought provoking message about mental health and the underprivileged in this country.10/10 Would Highly Reccomend"
"Phoenix fitted so we'll in his role as The Joker, reminded me of Health Ledger."
"Watched this film after hearing how great it was, but also aware it was a controversial film.
Simply put - this is a marvellous film, you don't need to read any of the reviews
i have watched it twice already and I'll most likely watch it again.To my mind - it's a Masterpiece.
I have the feeling this film will be talked about for a long time."
"If you like movies with no story and 2 hours of blah blah nonsense, this is for you! It was by far the most boring movie of 2019. A Joaquin Phoenix who overjusts, he wants to look like Depp? Of course, I understand the story of isolation and the psychological side. But what makes this film so special that it deserves a score of 8.8? Because of Joker's laughs? Because he shot people? The dark side was much better worked in Dark Knight Rises, here we are in a dark register, gore, depressing. Strange that this film is marketed in the United States when we see that it prone the ideology of Marxism.
Only the Joker had a character development. All other characters are boring stereotypes that do not contain a single story.
The cliffhangers are all predictable!
To conclude, I do not see this Joker fighting Batman at all."
"Just saw the movie in a midnight premiere in our local and favorite movie theater, and all I can say is thank you! Thank you Mr. Phoenix for a truly awesome, lovable and emotional performance, thank you Mr. Phillips for your creativity and writing. When it comes to Batman and all of Gothams citizens in the movies I'm always pretty sceptic wether they'll be played and portrait right, but when Mr. Phoenix was announced as the next Joker I knew there was no need to worry, then came the first teasers and trailers and my hope grew bigger, and now all I can say is thank you!!"
"Simply put, this movie is no masterpiece and if you think it is, you need to see WAY more movies. And by way more movies, I mean movies that aren't superhero movies. The funny thing about all the people who call this movie ""a masterpiece"" is that they can't qualify that claim in any way. Try it for yourself - ask the next person you talk to about Joker why it's a masterpiece. If you're lucky, you might get a response that goes as deep as them saying something vague about the writing and directing being amazing. Ask them to explain that. I guarantee you they won't be able to. This movie is one note, from beginning to end. Joker is crazy at the start, and crazy at the end. There is zero nuance, subtlety or character development. He simply goes from being crazy to crazier. It is cynical, lazy and a dull retread of the REAL masterpieces (like Taxi Driver and King of Comedy) from which it shamelessly steals (poorly, I might add). Beware of anyone who calls this a masterpiece, they have zero understanding of cinema."
Never have I ever sat 15 mins after the movie ended just thinking about what happened. This movie is a masterpiece of this decade. I don't think any other movie of this decade will top this.
AMAZING 😍 GENIUS!! A REAL MOVIE. WILL WATCH OVER AND OVER AGAIN
