"K this was an incredible work of art, not gonna beat around the bush. Jauquin pheonix is giving a career highlight here, it might be even better than his performance in the master but I'll have to think about that. Tod philips and cinematographer Laurence shaper have made a beautifully shot movie, and the shot length really gives pheonix and De Niro room to act. The camera work itself is also very well done, but its not the type off camera work that calls attention to itself like that of Paul Thomas Anderson or Martin Scorsese. The blending of reality and fantasy and reality is also extremely well handled, I'm not gonna give spoilers but I will say that its kind of like American psycho and middle school:the worst years of my life (does anybody's remember that book?). It is important to mention that this movie is not for everyone, it is violent and intense, but that being said its not as violent as other art house movies like drive or hereditary. No, its not really the violence as much as the intensity and the emotion that the film evokes, which is most certainly not a complaint its a great aspect of the film. Cinifix's 10 most emotional movie moments has 2 slots in it that focus on second hand embarrassment or cringe and deep uncofortable-ness and I'd say about 87 percent of the film are squarely in those 2 spaces. Overall this movie in its own special way is a masterpiece, even if its not at all easy to watch."
"Great acting, awesome atmosphere, fantastic music and an all great round film. I've never reviewed a film before but I found this film to excel my expectations despite taking a different direction to what I was expecting."
Abit of a slow start but loved every minute. Can't wait for a second!
"Very heavy movie. Looked in one breath.I am a reviewer, but I can't find the words. Simple, high quality, hard, smart. Becoming a villain from a harmless person. Society is to blame. Always.Watch everyone!"
"""Joker"" is without a doubt the greatest film I've ever seen, (and I've seen my fair share) thats not overstating it one bit on my part, the sheer impact this film had on me was overwhelming, and the absolute and genuine empathy I had for Arthur Fleck is heart felt, and the dark subject matter it deals with is true to our times, I was fully engrossed with him and in his corner throughout, I instantly knew I had just watched a masterpiece, from the very beginning to the very end of this film it has you totally and utterly encapsulated and fully absorbed, i urge everyone to see Joker you'll be watching the art of movie making! a Joker sequel could work or it could just be a stand alone film it really is that versatile 10/10 I would give it 100/10 if I could. 👌🏻🤡👏🏻👏🏻👏🏻"
"Take the next ingredients :
The King of ComedyRequiem for a DreamThe Dark KnightTaxi DriverMix all of these and then ladys and gentlemans we have : Joker ."
"Oscar winning performance from Phoenix, the film gets into the fabric of the Jokers madness, and his intelligence. Great cinematography and scene formation. Great supporting sound track. Sorry to the haters, but this is up there. Enjoy!"
"Saw it yesterday and it is still replaying in my head. Loved every minute of it.
The acting was phenomenal. In some scene Joaquin was conveying several emotions at the same time with total surrender and believability. I was just in awe to see a human do this. That's acting on master level. At the same time you saw this very fragile looking human being a victim of his illness and environment and on the other this incredibly strong will (insanity ?) shining through. The cinematography was just amazing. I was drawn into this dark depressing environment but with such a visual clarity and details. I almost forgot the music. There was this cello music emphasizing dark insanity coming out drawing you further into the scenes. And during the action scenes some very fitting songs were started in perfect synchrony. Great.
One of the best movies I have ever seen. A real masterpiece."
"It was pretty clear from before the movie got released that despite being a central comic book villain, Joker would not be anywhere along the lines of any superhero/super villain film we've ever seen. Instead of having the clown of Gotham going on a mad rampage to burn down the city, we witness an origin story for Joker : a story of how a normal if not slightly delusional person on being bogged down by society can turn into an uncontrollable, cold-blooded madman that we all know of.Joker's alter ego Arthur Fleck's struggles makes it immensely relatable and it is amazing to watch the character develop throughout the film. Joaquin Phoenix never fails, delivering a strong performance and proving that he is one of the best, most devoted method actors in the industry.Joker rides on a simple plot fueled by a cast of extraordinary actors and a spine-chilling soundtrack which goes perfect with the protagonist's actions. With a couple of gory scenes, the movie can feel a bit heavy to handle. The movie, with beautiful cinematography ,successfully captures the essence Prince Clown of Gotham!"
"An origin's tale which does justice to one of the most iconic villains in cinematic history. A breathtaking performance by Phoenix brings a new perspective to the audience's perception of the Joker's enigmatic persona.Led by Todd Phillips' sharp direction, the film portrays the tale on a very dark canvas in the backdrop of a Gotham city in hopeless turmoil. The film is punctuated by a negative vibe throughout, courtesy of the dark tones, the filthy alleyways, graffiti-filled walls of Gotham city and Fleck's sombre mindset.Phillips is able to carefully thread through the scenes to show the birth and evolution of this ""mentally-ill loner"" who is knocked down time and again by the city's fragile societal structure as well as discoveries about his disturbed past. In the process, he gives us a powerful insight into his mind and how it breaks down beyond repair, probably epitomised by the moment when he murders his own beloved mother.A mind-boggling watch overall, which is excruciatingly painful yet beautiful at the same time, with the laughter ""condition"" acting as a perfect foil to this legendary character."
This is the movie that makes you unsatisfied. Unsatisfied because you don't wanna stop the screen presence of Joaquin till the end of the movie... and even after.. Masterpiece 😎
"Seriously, I'm just going to cut all the way through the BS. I love movies, I have always loved movies. I know what's good and what's bad. You need to go see this right now. Movies like this rarely come along, maybe once or twice in a lifetime, go see it."
"I was highly sceptical at first regarding how the movie will turn out to be, going by the plot, I had no doubts about Joaquin, one of the best actors of his generation.
I am so unbelievably impressed by his acting, Todd's direction, the sound, the score, cinematography, the 80s vibe. Its been YEARS I've seen such a great movie with great everything in it. I can understand why some of the critics dislike this movie while they like similar or even more hardcore movies compared to this, one of the main reason has to go to the realistic feel of this movie, i have never seen acting like that ever before. The movie is so realistic and it tackles real life issues that ought to make anyone uncomfortable but in a positive way, i do not think this movie has the potential to incite gun violence etc(please, john wick anyone?), those are just rubbish. And lastly, we can not compare Heath and Joaquin's Joker, they are a class of their own."
You do not leave the same person after seeing the Joker.
My only issue with the movie is the lack of this line
"The film is one of the most beautiful films that I have seen for the actor, the great Jokaine Phoenix. The sequence of events and the soundtrack is fantastic"
"But, my new favorite movie ever. Its an absolute must-watch. I made an account just to make this review."
"The character development in this film is amazing. Reflecting on the person you saw at the beginning of the film and at the end are so totally incomparable. Heath Ledger set a high bar, and this film was a fantastic and different take on a story. It was totally gripping - one of those films you talk about for 2 hours solidly after seeing."
"Pure art, pure masterpiece. Unconventional brilliance, you have to see it and feel it.
I'm left speechless ..
Thank you!"
"Now this is why i keep going forward in life because of films like this masterpiece with a true message and by far Phoenixe's best role, some great acting and him and ledger are good in their own way.Definitely a well made jokers origins story, i couldn't ask for it better, everything about it, the cast, picture, action and the plot were fantastic and definitely sets up Christopher Nolans magnificent Batman franchises."
"This movie is a masterpiece. If you ever were bullied or have had depressions and felt like everybody is against you, you will feel with the joker through the whole movie.
This movie is unsettling from the get go and gets only worse from there on (but in a good way:)). As we witness how the character - Arthur Fleck, who will become the joker - is gradually sinking into insanity, caused by the selfish and cold world he lives in and by his own psyche.
The role of the Joker is delivered brilliantly by Joaquine Phoenix, who in my opinion, deserves an oscar for it.But beware!
Its a movie unlike other superhero movies. This one is more of a character study of the joker, why he became who he is. I would sort it into the Genre of Drama/Thriller."
"Pros are obviously Joaquin is amazing and the direction is competent and it's beautiful and I actually liked a lot of the changes they've made Bc it's an origins story. Cinematography= excellent. I love the grittiness, the swearing, the constant chain smoking, the blood, the scene in the apt when he murders the guy with the knife and lets the little man go was great, the girlfriend thing being all in his head was great, joaquins dancing was great....Cons= a lot of the writing was just lazy. He got away from murder way too easily (literally nobody was in the subway tunnel= needlessly convenient) the murders of 3 random punk kids starting a crazy movement of violence was unbelievable and stupid (they weren't important at all just 3 rich kids with no explanation?) although I liked the idea of Thomas Wayne being a bad guy pretty much every scene with him was stupid (the joker sneaks into the theatre so easily during the protests=stupid) the end where he gets murdered in the alley during the violence was really stupid and so lazy (the guy was running for mayor and had no body guards or anything= totally forced the Batman connection). I liked the themes but they were way too overt, like when he basically rants on tv about his mental illness before shooting Robert deniro... totally not like the joker at all... I don't care if it's supposed to be like that.. it could have been a lot more subtle and natural but wasn't... and finally, although it was gritty and dark... I feel like they were still way too careful and preachy... like I was expecting him to kill a lot more people and honestly hoping for it because that's what the joker does especially for his origin story! Everyone is obsessing over it and saying it's amazing but I really just think that it fell short on Way too many levels. Worth the watch and definitely more bold than most but could've been great and simply isn't."
"Peter Bradshaw of the Guardian has got be the worst film critic on the planet!
How did he ever get a job doing this.
He is clueless.
Ignore his review .
This is a brilliant piece of film making"
At loss of words. Legacy of Heath has continued finally someone picked up where he left. Wow what a performance. I can still hear the laugh.
"This film is definitely a masterpiece. This is probably the most realistic film I've seen since The Dark Knight. The color grading, the soundtracks, the costumes, and overall EVERYTHING is phenomenal. Truly an Oscar Worthy performance by Joaquin Phoenix, Robert De Niro, and others. This film mainly depicts on mental illness, rich vs poor, and what would happen to a person if society doesn't treat him/her well. NO JOKE YOU SHOULD WATCH THIS FILM!!!"
"After the credits started rolling I sat in my chair thinking is this real? Did they really make such a movie? Are they even capable of making movies like this? This is easily the best movie I have watched in God knows how many years. Oh, and Joaquin Phoenix deserves an Oscar"
"I just saw the movie for the second time, and i'm gonna go watch it for the third time and even a fourth time.This movie is amazing, everything in this movie is incredible. It really deserves an oscar."
"As someone who isn't that big of a fan of the DCEU thanks to the quality of the films being kind of wonky (a few are great, a few are just okay, a few are really bad), I wasn't expecting that much here, considering that this film, besides having the Joker, has nothing to even do with the DCEU. Plus, as great as Joaquin Phoenix is as an actor, he was never exactly the first guy to come to mind when thinking of who to play the demented clown himself. So, you can imagine my shock and amazement after coming out of the movie theater, because, oh my god, this film is incredible. It takes everything you thought you knew about the Joker and not only flips it on its head, but expands upon it tenfold. The way this film portrays what Arthur is going through and how he evolves into the Joker is some of the best character development I have ever seen in a film. This film has a perfect balance of making you sympathize with the main character, while also making you mindful of the terrible acts he has done. It can feel a bit disturbing to almost side with someone who's obviously dangerous, but the way this film manages that is genius. All of this is helped by two things. Smart and excellent writing, as well as the performance. The story is great. It's well paced, thought provoking, smart, poignant, and constantly almost eye opening. Joaquin Phoenix was pretty much perfect. His performance is Oscar worthy here, as he really did become the main character. When Arthur laughed because of his condition, I really felt the pain behind it. Seeing how his life is and how he lives it really seemed real, and that's what helped me sympathize with him, even though, again, he's dangerous. If all of that wasn't enough, everything else about this movie is great too. The direction from Todd Phillips really shines, as the way this film is structured and put together helps the film not only flow really well, but to be delightfully dark and twisted. The performances from everyone else were all great too. Robert De Niro was phenomenal as Murray Franklin, as he was very committed, which helped him really turn into the talk show host from this film. The same thing can be said for everyone else, whether it be Frances Conroy as Arthur's mother or Zazie Beetz as his love interest. Everyone did great, as well as Todd Phillips for making such an incredible film that delves into the mind of the demented clown while making it extremely heartfelt. I also loved how they linked the Wayne family to the story. I won't say what happened to avoid spoilers, but that really helped this feel like a true part of Batman's past, all of which happened in a movie where the caped crusader isn't even around yet (I hope, because a Batman film after this would be awesome in my opinion). Overall, this film is amazing, and I recommend anyone who hasn't seen it to do so, because it not only has fan service aplenty to longtime fans of the Joker, but it also has everything that makes a great movie great so that it can be enjoyed by anyone. One last thing to note is that there is a lot, and I mean a LOT of gore in this film, so if you're squeamish about that, then I'd probably wait until I'm ready to see it. I say watch this with an open mind, and what you'll experience is a thought provoking masterpiece that tells a story you never thought hard about and tells it damn near perfectly."
"The first half was boring the second was a bit better. The actor did a good job, however overall average movie. Nothing special."
Joaquin phoenix should get an Oscar for this.movie is outstanding.
It was a privilege to experience this film. Joaquin Phoenix exceeds expectations in every aspect. Director Todd Phillips does an amazing job of delivering such an exhilarating character piece even given the film's contrast to those that he has directed in the past. Joker speaks an unspoken truth about the human condition and is an absolute must-watch.
"This movie was absolutely amazing in every way. I'm so glad they finally displayed mental illness in the correct way and although he was/ is the bad guy, it also sheds light on what causes someone like him to snap. I would watch it over and over again. The actor deserves an Oscar. He was awesome."
"If you walked out of this, give it a few... Frozen 2 will be out soon enough."
"I have to admit that I had a certain fear to this film.
The first thing I'm a big DC fan, the Joker is my favorite DC villain, and to make a movie about him without Batman, somehow illogical and unimaginable.
Second, the director is Todd Phillips who has now done only comedies (admittedly good and really good) such as Hangover, Due Date and Road Trip. I knew that Joaquin will be great as he has already proven and rewarded an actor with several great roles, but history has taught me that it's no guarantee because the last Joker was catastrophic and the actor is also a great actor (Jared Leto has an Oscar).I was so wrong.The film is perfect, crafty and brutal.
Most of all it tells me that even after three days of looking at it, I still think about him, about acting, about scenes, about music, about a possible message.
As expected, Joaquin was singled out by the big screen overall. Each scene is his own, he ate the part and ordered the desert afterwards. He brutally gave himself into it, physically and mentally. Honestly, it will be a bigger surprise if he doesn't win an Oscar, but it doesn't even matter given the award history. He showed so many emotions and layers of one fictional character on a larger level, leaning to the floor!
Any comparisons to Ledger are unnecessary, they both did the job to the highest possible level, each with their own version that fits the film. Both are perfect.
I did mind the two minor things in the movie, however they turned it around to fit the story so I have no qualms.
I really like that this can't be called some kind of superhero movie that we've been bombarded with for years, it's a pure psychological drama. It reminded me a lot of the tone and atmosphere of Taxi Driver, even in some scenes one can see the impact and similarities in Martin Scorsese's film. It was as if it was shot in the 1970s which was Hollywood's prime golden age.Honestly, the reactions of film critics, ranging from disappointment to excellent, were not clear to me. In the last few years, you may have 5 films for which you will become a cult classic in the future. The Joker is definitely one of them.Purely subjective and well deserved ten!"
"Finally we get a Joker who is not Batman-centered, a Joker who walks his own path and tells his own story. Thank you!
This is the best 2019 movie to hit theaters and it will stay in the minds everyone who watched for a long time whether you liked or disliked it.
It's not a movie for the critics' praise, rather than a medical diagnosis of our time. Should you fail to notice the message Joker brings, you might as well surround yourself with happy thoughts and watch a Disney movie."
"I never write reviews for any movie. This movie made me write it, Well Joaquin Sir..Take a bow.
What a superb acting. We start with having sympathy with the character and end up supporting him.
Somehow we don't feel that whatever he does is wrong. It feels justified.
Crisp direction and amazing background music.It's a must watch. Go and see it today."
"I've heard a handful of people say this is a bad film
That's there opinion fair enough
Joachim Phoenix is amazing in this to the point I think he is a better joker than Heath Ledger which is a bold statement as I loved Heath as the joker
Phoenix takes this role and runs with itI could watch over and over"
"Joker was not only a fantastic story that was filled with emotion and intensity, it also portrayed mental illness as something that should be taken care of in the real world. When you watch Joker he does all these crazy things in the movie but the story isn't necessarily telling us to forgive him for his acts but more or less understanding him for what he did.The story was so well put with emotion and heart breaking agony for the main character and joker made it seem as if he couldn't take it anymore. Phoenix took his acting to a whole other level for this film and him and this film definitely deserves an Oscar"
"By far the film of the year, Joaquin Phoenix morphs from Arthur to Joker seamlessly, and it isn't rushed, it just slowly unravels into chaos stunningly.
Range of emotions, from shock, amazement & sorrow.
A sad plight, perfectly executed."
"Even days after watching this I literally cannot get Joker out of my head. It's one of the best films I have seen in years. It's dark, menacing, chaotic & yet beautiful. Joaquin's portrayal of Joker is simply mesmerising. His performance was chilling yet moved me to tears, just so inspiring."
He really deserves an Oscar for Best Actor. Astonishing performance. I am so feel in his deep character. And I am sure that this film will sweep Oscars next year. This film is Super Contender for Oscar ! 10/10 ⭐⭐⭐⭐⭐⭐⭐⭐⭐
8.5/10. Incredible acting by Joker. Should win best actor easily. Directing is also Oscar worthy. All in all an incredible film which can be watched several times with different interpretations. Will probably go see it again soon and the rating could go up from a 8.5 to a 9 once I wrap my head around it all. A well done film.
Oscar worthy! Amazing mental twisted! One of my all time favorites!
"I have waited this movie since Todd Phillip's announcement of this movie. Great Story, Great Acting, Great Score. JOKER deserve an Oscar Nomination. Joaquin Phoenix deserve An Oscar for his performance."
"I went to the greatest movies I have ever seen in my 54 year life. Joker is not a villain. I gave it 10 stars, to the Oscar people it deserves at least 10 of those.
Phoenix will receive an Oscar for sure."
One in a lifetime movie! The plot will have you on the edge of your seat. Joaquin Phoenix deserve an Oscar for his role as the joker. Todd Phillips could have not wrote or directed a better script .
Not a single point in this movie will dissapoint anyone . As we know that joker in dark knight has set huge mark on peoples heart . This movie had not let its progress down . The most satasfying movie and really good thinking from director about how jokers life will be in his days . Brillant work
"This is just my opinion but I loved the Joker, the performances, cinematography, directing, style, all build a great story. And the acting from Phoenix was incredible, he done a great take for the iconic character, and wow does he commit, with loosing the weight for the role, to developing the laugh."
"#Joker is intense, bold, disturbing, and surprisingly poignant at times. Joaquin Phoenix gives a stunning performance that's equally as disturbing as it is emotionally layered. Oscar-worthy in every way. Beautiful cinematography and an incredible score by Hildur Guðnadóttir."
"First of all, dont expects that you will get an action movie cause this film isn't an action movie. The experience this movie will give is unpredictable, the music, the cinematography, the character development, the storytelling, all of of this things looks solid. This movie deserve oscar. 10/10"
"Best Movie Ever Made. The Acting, The Direction, The feels.
This is DC."
My favourite film of 2019. Beautiful acting from Phoenix and something i'll be thinking about for days!
"Just came back from a screen of this & was blown away by how good it was! I knew it be great anyway, but from actually seeing it, I'm convinced!The film tells the backstory of how the Joker became who he was & what his personal life was like before he snapped & became a cold blood murdering villain!I found the film to be fully engaging! It was dark, blood, brutal & visually stunning! The actors done great jobs & preformed very well by giving convincing portrayals!I'm starting to like the trend in the DC Universe where these 15+ versions are showing us the raw & truly gritty side of these villains/heroes you never get to see in these watered down 12+ versions!Overall an epic, brutal & raw story about the Joker!Go & see this! 10/10"
"Someone pass me an adjective. Listen to no haters or outragers. Go see it right now!!!! Thank you for making this masterpiece. I hope everyone involved in making this film is proud. They deserve all praise. Just WOW. I spent half the movie with my jaw dropped literally. My faith in good cinema is returning. Knock Knock, I want more"
What a movie im still shaked best actor for joker what a master piece!!! Loved it
