tweet_id,account_name,user_id,timestamp,text,links,repiles,retweets,favorites
1202739263923740672,Big Willy,1149668303033569280,3:59 PM - 5 Dec 2019,saw   the other night  very good. There's a doc on Carroll Shelby on Netflix that is actually better imo.,,Null,0,1
1202739131371204609,photo_gt97 🇹🇹,2996957211,3:58 PM - 5 Dec 2019,I’m late to the party but I’m here let’s go     ,,Null,0,1
1202738975934472193,Big Poppi,746321048,3:58 PM - 5 Dec 2019,Knives Out was pretty good.        was amazing!,,Null,0,1
1202738873077506048,Mohammad Almisbaa,430427083,3:57 PM - 5 Dec 2019,It's fantastic I rated   (2019) 10/10 - ,https://www.imdb.com/title/tt1950186/,Null,0,2
1202738668559052800,Mark Ludwiczak,327028340,3:56 PM - 5 Dec 2019,*I have yet to see Marriage Story  Knives Out  Waves     Uncut Gems or The Lighthouse and could easily see those jumping into the mix ,https://twitter.com/marklud12/status/1202733553601204224,Null,0,1
1202737280844206081,Teresa🌎☄️BurbankCon2019✨,1000558352437534721,3:51 PM - 5 Dec 2019,Looks like you were having fun.,,Null,0,0
1202736965646520321,يوسف عصام الجيماز,2853094394,3:50 PM - 5 Dec 2019,I rated   (2019) 10/10    ,https://www.imdb.com/title/tt1950186,Null,0,0
1202735999400529920,KHALED AlHASHASH,335909052,3:46 PM - 5 Dec 2019,I rated   (2019) 8/10    ,https://www.imdb.com/title/tt1950186,Null,0,0
1202735951858077698,Evan Lucken,19799464,3:46 PM - 5 Dec 2019,Here to see    show time was 6:25 and the trailers are still rolling. Come on guys  that's way too long.,,Null,0,1
1202735366802984961,jason kohler,456887337,3:43 PM - 5 Dec 2019,Just watched    great film ,,Null,0,0
1202732844554051584,AJ Foyt Racing,39666777,3:33 PM - 5 Dec 2019,"Showing up every day and putting on a near exact replica of a race suit with my dad’s name on it was a strange but special experience."   Alex Gurney ( ) shares what it was like working on    along with Jeff Bucknum.   ,https://www.foytracing.com/single-post/2019/12/05/2nd-Gen-Drivers-Gurney-Bucknum-talk-about-working-on-Ford-V-Ferrari,Null,4,22
1202732765365469184,¯\_(ツ)_/¯,1042970252,3:33 PM - 5 Dec 2019,My top 10 in order: Rocketman Knives Out Parasite  Queen & Slim Joker    The Peanut Butter Falcon  Jojo Rabbit Midsommar Honey Boy ,https://twitter.com/ringer/status/1202714613013331968,Null,0,1
1202732095317123072,Alfred Castro,1094314601867628544,3:30 PM - 5 Dec 2019,Just watched    good ass movie,,Null,0,2
1202731921421348864,Tyler Wolff,2741200161,3:30 PM - 5 Dec 2019,Great to see some   and   love! Other than the top 4  this is pretty much out of order! ,,Null,0,1
1202731735051653127,thalia,1155753810913923073,3:29 PM - 5 Dec 2019,queen i love u,,Null,0,0
1202731321191211009,Artemis,1111257958845800448,3:27 PM - 5 Dec 2019,  I thought  you want to come in through the window,,Null,0,0
1202731280208547841,Stephen Dullin |•'-'•)و✧,536317087,3:27 PM - 5 Dec 2019,You should have jumped through the window like a boss and then started the car.,,Null,0,0
1202730999420899328,Kevin Kong,1143339543740866562,3:26 PM - 5 Dec 2019,I think Joker deserves to be on the list but Richard Jewell should not be here.   should be in there.,,Null,0,0
1202730929611005953,Immaculate Mbaezue,1152002694439194624,3:26 PM - 5 Dec 2019,Daily Box Office Top 5 for Wednesday  December 4  2019  1.   - $2.82M 2.   - $1.74M 3.   - $925K 4.   - $830K 5.   - $810K  ,,Null,0,0
1202729715469029377,Chris Gill,727155462,3:21 PM - 5 Dec 2019,Finally    with ,,Null,0,2
1202739263923740672,Big Willy,1149668303033569280,3:59 PM - 5 Dec 2019,saw   the other night  very good. There's a doc on Carroll Shelby on Netflix that is actually better imo.,,Null,0,1
1202739131371204609,photo_gt97 🇹🇹,2996957211,3:58 PM - 5 Dec 2019,I’m late to the party but I’m here let’s go     ,,Null,0,1
1202738975934472193,Big Poppi,746321048,3:58 PM - 5 Dec 2019,Knives Out was pretty good.        was amazing!,,Null,0,1
1202738873077506048,Mohammad Almisbaa,430427083,3:57 PM - 5 Dec 2019,It's fantastic I rated   (2019) 10/10 - ,https://www.imdb.com/title/tt1950186/,Null,0,2
1202738668559052800,Mark Ludwiczak,327028340,3:56 PM - 5 Dec 2019,*I have yet to see Marriage Story  Knives Out  Waves     Uncut Gems or The Lighthouse and could easily see those jumping into the mix ,https://twitter.com/marklud12/status/1202733553601204224,Null,0,1
1202737280844206081,Teresa🌎☄️BurbankCon2019✨,1000558352437534721,3:51 PM - 5 Dec 2019,Looks like you were having fun.,,Null,0,0
1202736965646520321,يوسف عصام الجيماز,2853094394,3:50 PM - 5 Dec 2019,I rated   (2019) 10/10    ,https://www.imdb.com/title/tt1950186,Null,0,0
1202735999400529920,KHALED AlHASHASH,335909052,3:46 PM - 5 Dec 2019,I rated   (2019) 8/10    ,https://www.imdb.com/title/tt1950186,Null,0,0
1202735951858077698,Evan Lucken,19799464,3:46 PM - 5 Dec 2019,Here to see    show time was 6:25 and the trailers are still rolling. Come on guys  that's way too long.,,Null,0,1
1202735366802984961,jason kohler,456887337,3:43 PM - 5 Dec 2019,Just watched    great film ,,Null,0,0
1202732844554051584,AJ Foyt Racing,39666777,3:33 PM - 5 Dec 2019,"Showing up every day and putting on a near exact replica of a race suit with my dad’s name on it was a strange but special experience."   Alex Gurney ( ) shares what it was like working on    along with Jeff Bucknum.   ,https://www.foytracing.com/single-post/2019/12/05/2nd-Gen-Drivers-Gurney-Bucknum-talk-about-working-on-Ford-V-Ferrari,Null,4,22
1202732765365469184,¯\_(ツ)_/¯,1042970252,3:33 PM - 5 Dec 2019,My top 10 in order: Rocketman Knives Out Parasite  Queen & Slim Joker    The Peanut Butter Falcon  Jojo Rabbit Midsommar Honey Boy ,https://twitter.com/ringer/status/1202714613013331968,Null,0,1
1202732095317123072,Alfred Castro,1094314601867628544,3:30 PM - 5 Dec 2019,Just watched    good ass movie,,Null,0,2
1202731921421348864,Tyler Wolff,2741200161,3:30 PM - 5 Dec 2019,Great to see some   and   love! Other than the top 4  this is pretty much out of order! ,,Null,0,1
1202731735051653127,thalia,1155753810913923073,3:29 PM - 5 Dec 2019,queen i love u,,Null,0,0
1202731321191211009,Artemis,1111257958845800448,3:27 PM - 5 Dec 2019,  I thought  you want to come in through the window,,Null,0,0
1202731280208547841,Stephen Dullin |•'-'•)و✧,536317087,3:27 PM - 5 Dec 2019,You should have jumped through the window like a boss and then started the car.,,Null,0,0
1202730999420899328,Kevin Kong,1143339543740866562,3:26 PM - 5 Dec 2019,I think Joker deserves to be on the list but Richard Jewell should not be here.   should be in there.,,Null,0,0
1202730929611005953,Immaculate Mbaezue,1152002694439194624,3:26 PM - 5 Dec 2019,Daily Box Office Top 5 for Wednesday  December 4  2019  1.   - $2.82M 2.   - $1.74M 3.   - $925K 4.   - $830K 5.   - $810K  ,,Null,0,0
1202729715469029377,Chris Gill,727155462,3:21 PM - 5 Dec 2019,Finally    with ,,Null,0,2
1202729430914936832,.,1090377980,3:20 PM - 5 Dec 2019,I rated   (2019) 10/10  ,https://www.imdb.com/title/tt1950186,Null,0,0
1202729160327811072,💎ناهض : الزعيم العـ💙المـي,355901032,3:19 PM - 5 Dec 2019,I rated   (2019) 9/10    ,https://www.imdb.com/title/tt1950186,Null,0,0
1202728725567221762,Abdulrahman,1544911387,3:17 PM - 5 Dec 2019,I rated   (2019) 8/10    ,https://www.imdb.com/title/tt1950186,Null,0,0
1202727484070023174,Tanner,1629016200,3:12 PM - 5 Dec 2019,Some of my favorite Movies from 2019 so far...  The Irishman Jojo Rabbit Knives Out Once Upon a Time in Hollywood   Avengers: Endgame The Peanut Butter Falcon A Beautiful Day in the Neighborhood Under the Silver Lake Booksmart The Last Black Man in San Francisco,,Null,1,22
1202727196902744064,red mamba,318098123,3:11 PM - 5 Dec 2019,Yea I almost put that over  . Great movie just not very rewatchable lol,,Null,0,0
1202726565034909696,Timothy Huls,16627072,3:08 PM - 5 Dec 2019,What a great shot! Such an honor to be in this photo taken by " " director   . Three of the best weeks of my life on this set  hands down.,https://twitter.com/mang0ld/status/1202394281081573376,Null,0,1
1202726518532608000,Logger FAL,1026306352459575296,3:08 PM - 5 Dec 2019, Once yon a time?  Wtf   ,,Null,0,0
1202726260746735617,red mamba,318098123,3:07 PM - 5 Dec 2019,Parasite OUATIH John Wick 3 The Farewell    Honorable mentions:  Toy Story 4  The Lighthouse ,https://twitter.com/ringer/status/1202714613013331968,Null,0,1
1202725714362912768,theWatcher,82553012,3:05 PM - 5 Dec 2019,I can't be the only one who thought she was practicing how "OPEN THE DOOR PROPERLY" when being chased by a deranged serial killer in a horror movie. She was going to end that trope.,,Null,0,0
1202725597417361408,Рев. Виктория Вальш,21961093,3:05 PM - 5 Dec 2019,Guhhhhh  that’s so much harder to answer! There’s still like 20 movies I want to see from 2019  but I’ll give it a try real quick  again in no real order.  Jojo Rabbit Avengers: Endgame   Ready or Not Knives Out,,Null,0,1
1202724914987450368,frank hineline,1198336908524498944,3:02 PM - 5 Dec 2019,it is soo good...you are missing out if you havent seen it in theaters...missing rocketman is not a big deal but   can't be missed...so much fun,,Null,0,0
1202723755212103683,Immaculate Mbaezue,1152002694439194624,2:57 PM - 5 Dec 2019,Disney will expand Fox's   from 3 446 to 3 746 screens this Friday  December 6. ,,Null,0,0
1202723713516363776,Chris Berry,797914226,2:57 PM - 5 Dec 2019, is perhaps the best racing film ever made. Its premier-quality acting (from Bale and Damon)  impressive cinematography in the racing scenes  and excellent sound editing/mixing all help bring the film's heart-felt story to be individually inspiring and enjoyable. ,,Null,5,8
1202723573405822978,Greenland,926477610309308416,2:57 PM - 5 Dec 2019,DonUbehadaruShoNmYAlcoHOL ??,,Null,0,0
1202723508901560321,Drew,3411796481,2:56 PM - 5 Dec 2019,Ad Astra Once upon a time in HW Shazam   Ready Or Not ,https://twitter.com/ringer/status/1202714613013331968,Null,0,0
1202723460981628928,Immaculate Mbaezue,1152002694439194624,2:56 PM - 5 Dec 2019, grossed $830K on Wednesday.  20-Day total stands at $83.80M.        ,,Null,0,0
1202723000447057921,Jeff Braun,147072470,2:54 PM - 5 Dec 2019,Once Upon A Time In Hollywood Parasite    John Wick 3 The Irishman ,https://twitter.com/ringer/status/1202714613013331968,Null,0,2
1202722984542142467,Victor Reyes,398784829,2:54 PM - 5 Dec 2019, is becoming like Rocketman for me. Movie I wanted to see since it’s release but still haven’t watched it. I miss it for whatever reason & I never get around to it.,,Null,0,0
1202722920436510722,Will Mackenzie,82098292,2:54 PM - 5 Dec 2019,1. Booksmart 2. Green Book 3. Wild Rose 4. Le Mans ‘66 ( ) ,,Null,0,2
1202722825527803910,♡jess♡,998739894376812546,2:54 PM - 5 Dec 2019,You’re so cute omg,,Null,0,0
